<?xml version="1.0" encoding="UTF-8"?>
<!-- <!DOCTYPE catalog:movie_catalog SYSTEM "movie.dtd"> -->
<?xml-stylesheet?>
<catalog:movie_catalog xmlns:xsi="http://www.w3.org/2001/XMLSchema-instance" 
xmlns:catalog="http://www.dubenko.dev/catalog" 
xsi:schemaLocation="http://www.dubenko.dev/catalog movie.xsd">
  
  <!-- Metadata -->
  <autorzy:document_information xmlns:autorzy="http://www.dubenko.dev/catalog">
    <autorzy:lab_title>Movie viewer</autorzy:lab_title>
    <autorzy:proj_authors>
      <autorzy:author1>
        <autorzy:name>Yaroslav</autorzy:name>
        <autorzy:surname>Horetskyi</autorzy:surname>
        <autorzy:index_id>211714</autorzy:index_id>
      </autorzy:author1>
      <autorzy:author2>
        <autorzy:name>Oleksandr</autorzy:name>
        <autorzy:surname>Dubenko</autorzy:surname>
        <autorzy:index_id>211651</autorzy:index_id>
      </autorzy:author2>
    </autorzy:proj_authors>
    <autorzy:entire>Movie catalog</autorzy:entire>
  </autorzy:document_information>

  <!-- Movies -->
  <mov:movies xmlns:mov="http://www.dubenko.dev/catalog">
    <mov:movie IdMovie="m1" IdCompany="c1">
      <mov:title lang="pl">Skazani na Shawshank</mov:title>
      <mov:country>USA</mov:country>
      <mov:date>1994-09-10</mov:date>
      <mov:budget currency="usd">25000000</mov:budget>
      <mov:worldwide_gross currency="usd">58500000</mov:worldwide_gross>
      <mov:runtime timeFormat="min">142</mov:runtime>
      <mov:rate>9.3</mov:rate>
      <mov:category>Drama</mov:category>
    </mov:movie>
    <!-- ^Castle^ -->

    <mov:movie IdMovie="m2" IdCompany="c2">
      <mov:title lang="pl">Rodzina od zaraz</mov:title>
      <mov:country>USA</mov:country>
      <mov:date>2018-11-16</mov:date>
      <mov:budget currency="usd">48000000</mov:budget>
      <mov:worldwide_gross currency="usd">81025217</mov:worldwide_gross>
      <mov:runtime timeFormat="min">118</mov:runtime>
      <mov:rate>7.4</mov:rate>
      <mov:category>Comedy, Drama</mov:category>
    </mov:movie>
    <mov:movie IdMovie="m3" IdCompany="c2">
      <mov:title lang="pl">Operacja Overlord</mov:title>
      <mov:countries>
        <mov:country>USA</mov:country>
        <mov:country>Canada</mov:country>
      </mov:countries>
      <mov:date>2018-09-22</mov:date>
      <mov:budget currency="usd">38000000</mov:budget>
      <mov:worldwide_gross currency="usd">21704844</mov:worldwide_gross>
      <mov:runtime timeFormat="min">110</mov:runtime>
      <mov:rate>6.8</mov:rate>
      <mov:category>Action, Adventure, Horror</mov:category>
    </mov:movie>
    <mov:movie IdMovie="m4" IdCompany="c2">
      <mov:title lang="pl">Ojciec chrzestny</mov:title>
      <mov:country>USA</mov:country>
      <mov:date>1972-03-14</mov:date>
      <mov:budget currency="usd">6000000</mov:budget>
      <mov:worldwide_gross currency="usd">245066411</mov:worldwide_gross>
      <mov:runtime timeFormat="min">175</mov:runtime>
      <mov:rate>9.3</mov:rate>
      <mov:category>Crime, Drama</mov:category>
    </mov:movie>
    <mov:movie IdMovie="m5" IdCompany="c2">
      <mov:title lang="pl">Interstellar</mov:title>
      <mov:countries>
        <mov:country>UK</mov:country>
        <mov:country>USA</mov:country>
      </mov:countries>
      <mov:date>2014-10-26</mov:date>
      <mov:budget currency="usd">165000000</mov:budget>
      <mov:worldwide_gross currency="usd">675020017</mov:worldwide_gross>
      <mov:runtime timeFormat="min">169</mov:runtime>
      <mov:rate>8.6</mov:rate>
      <mov:category>Adventure, Drama, Sci-Fi</mov:category>
    </mov:movie>
    <!-- ^Paramaunt^ -->

    <mov:movie IdMovie="m6" IdCompany="c3">
      <mov:title lang="pl">Narodziny gwiazdy</mov:title>
      <mov:country>USA</mov:country>
      <mov:date>2018-08-31</mov:date>
      <mov:budget currency="usd">36000000</mov:budget>
      <mov:worldwide_gross currency="usd">214601602</mov:worldwide_gross>
      <mov:runtime timeFormat="min">148</mov:runtime>
      <mov:rate>7.8</mov:rate>
      <mov:category>Drama, Music, Romance</mov:category>
    </mov:movie>
    <mov:movie IdMovie="m7" IdCompany="c3">
      <mov:title lang="pl">Aquaman</mov:title>
      <mov:countries>
        <mov:country>Australia</mov:country>
        <mov:country>USA</mov:country>
      </mov:countries>
      <mov:date>1994-09-10</mov:date>
      <mov:budget currency="usd">25000000</mov:budget>
      <mov:worldwide_gross currency="usd">58500000</mov:worldwide_gross>
      <mov:runtime timeFormat="min">142</mov:runtime>
      <mov:rate>7.3</mov:rate>
      <mov:category>Action, Adventure, Fantasy</mov:category>
    </mov:movie>
    <mov:movie IdMovie="m8" IdCompany="c3">
      <mov:title lang="pl">Creed II</mov:title>
      <mov:country>USA</mov:country>
      <mov:date>2018-11-14</mov:date>
      <mov:budget currency="usd">50000000</mov:budget>
      <mov:worldwide_gross currency="usd">175431419</mov:worldwide_gross>
      <mov:runtime timeFormat="min">130</mov:runtime>
      <mov:rate>7.3</mov:rate>
      <mov:category>Drama, Sport</mov:category>
    </mov:movie>
    <mov:movie IdMovie="m9" IdCompany="c3">
      <mov:title lang="pl">Legion samobójców</mov:title>
      <mov:country>USA</mov:country>
      <mov:date>2016-08-01</mov:date>
      <mov:budget currency="usd">175000000</mov:budget>
      <mov:worldwide_gross currency="usd">746846894</mov:worldwide_gross>
      <mov:runtime timeFormat="min">134</mov:runtime>
      <mov:rate>6.1</mov:rate>
      <mov:category>Action, Adventure, Fantasy</mov:category>
    </mov:movie>
    <mov:movie IdMovie="m10" IdCompany="c3">
      <mov:title lang="pl">Wonder Woman</mov:title>
      <mov:countries>
        <mov:country>China</mov:country>
        <mov:country>USA</mov:country>
        <mov:country>Hong Kong</mov:country>
      </mov:countries>
      <mov:date>2017-05-15</mov:date>
      <mov:budget currency="usd">149000000</mov:budget>
      <mov:worldwide_gross currency="usd">821763408</mov:worldwide_gross>
      <mov:runtime timeFormat="min">141</mov:runtime>
      <mov:rate>7.5</mov:rate>
      <mov:category>Action, Adventure, Fantasy</mov:category>
    </mov:movie>
    <mov:movie IdMovie="m11" IdCompany="c3">
      <mov:title lang="en">Ocean's 8</mov:title>
      <mov:country>USA</mov:country>
      <mov:date>2018-06-05</mov:date>
      <mov:budget currency="usd">70000000</mov:budget>
      <mov:worldwide_gross currency="usd">283980167</mov:worldwide_gross>
      <mov:runtime timeFormat="min">110</mov:runtime>
      <mov:rate>6.2</mov:rate>
      <mov:category>Action, Comedy, Crime</mov:category>
    </mov:movie>
    <!-- ^Warner Bros^ -->

    <mov:movie IdMovie="m12" IdCompany="c4">
      <mov:title lang="pl">Drapacz chmur</mov:title>
      <mov:country>USA</mov:country>
      <mov:date>2018-07-11</mov:date>
      <mov:budget currency="usd">125000000</mov:budget>
      <mov:worldwide_gross currency="usd">292351275</mov:worldwide_gross>
      <mov:runtime timeFormat="min">102</mov:runtime>
      <mov:rate>5.8</mov:rate>
      <mov:category>Action, Adventure, Thriller</mov:category>
    </mov:movie>
    <mov:movie IdMovie="m13" IdCompany="c4">
      <mov:title lang="pl">Kong: Wyspa Czaszki</mov:title>
      <mov:countries>
        <mov:country>China</mov:country>
        <mov:country>USA</mov:country>
      </mov:countries>
      <mov:date>2017-02-28</mov:date>
      <mov:budget currency="usd">185000000</mov:budget>
      <mov:worldwide_gross currency="usd">566652812</mov:worldwide_gross>
      <mov:runtime timeFormat="min">118</mov:runtime>
      <mov:rate>6.6</mov:rate>
      <mov:category>Action, Adventure, Fantasy</mov:category>
    </mov:movie>
    <mov:movie IdMovie="m14" IdCompany="c4">
      <mov:title lang="pl">Jurassic World: Upadłe królestwo </mov:title>
      <mov:country>USA</mov:country>
      <mov:date>2018-05-21</mov:date>
      <mov:budget currency="usd">170000000</mov:budget>
      <mov:worldwide_gross currency="usd">1309484461</mov:worldwide_gross>
      <mov:runtime timeFormat="min">128</mov:runtime>
      <mov:rate>6.2</mov:rate>
      <mov:category>Action, Adventure, Sci-Fi</mov:category>
    </mov:movie>
    <mov:movie IdMovie="m15" IdCompany="c4">
      <mov:title lang="pl">Incepcja</mov:title>
      <mov:countries>
        <mov:country>UK</mov:country>
        <mov:country>USA</mov:country>
      </mov:countries>
      <mov:date>2010-07-08</mov:date>
      <mov:budget currency="usd">160000000</mov:budget>
      <mov:worldwide_gross currency="usd">825532764</mov:worldwide_gross>
      <mov:runtime timeFormat="min">148</mov:runtime>
      <mov:rate>8.8</mov:rate>
      <mov:category>Action, Adventure, Sci-Fi</mov:category>
    </mov:movie>
    <mov:movie IdMovie="m16" IdCompany="c4">
      <mov:title lang="pl">Watchmen- Strażnicy</mov:title>
      <mov:country>USA</mov:country>
      <mov:date>1994-09-10</mov:date>
      <mov:budget currency="usd">25000000</mov:budget>
      <mov:worldwide_gross currency="usd">58500000</mov:worldwide_gross>
      <mov:runtime timeFormat="min">142</mov:runtime>
      <mov:rate>9.3</mov:rate>
      <mov:category>Drama</mov:category>
    </mov:movie>
    <mov:movie IdMovie="m17" IdCompany="c4">
      <mov:title lang="pl">Skazani na Shawshank</mov:title>
      <mov:country>USA</mov:country>
      <mov:date>2009-02-23</mov:date>
      <mov:budget currency="usd">130000000</mov:budget>
      <mov:worldwide_gross currency="usd">185258983</mov:worldwide_gross>
      <mov:runtime timeFormat="min">215</mov:runtime>
      <mov:rate>7.6</mov:rate>
      <mov:category>Action, Drama, Mystery</mov:category>
    </mov:movie>
    <!-- ^Legendary^ -->

    <mov:movie IdMovie="m18" IdCompany="c5">
      <mov:title lang="pl">Bohemian Rhapsody</mov:title>
      <mov:countries>